{
  "dataset_name": "dolly-sample",
  "source_url": "local-file://data/raw/dolly-sample.json",
  "splits": {
    "train": {
      "num_samples": 60,
      "path": "data/processed/train.jsonl"
    },
    "valid": {
      "num_samples": 20,
      "path": "data/processed/valid.jsonl"
    },
    "test": {
      "num_samples": 20,
      "path": "data/processed/test.jsonl"
    }
  },
  "statistics": {
    "total_records": 100,
    "duplicate_count": 0,
    "format_error_count": 0,
    "leakage_detected": false,
    "mean_instruction_tokens": 10.42,
    "mean_response_tokens": 79.01
  }
}